{
  "schemaVersion": 1,
  "taskId": "nlp-dependency-parser",
  "fixtureId": "en-basic",
  "sourceConlluPath": "fixtures/conllu-dependency/valid/en-basic.conllu",
  "documentId": "dependency-parser:en-basic",
  "sentenceId": "en-basic-1",
  "tokenOrder": ["1", "2", "3", "4"],
  "arcs": [
    { "dependent": "1", "head": "2", "relation": "nsubj" },
    { "dependent": "2", "head": "0", "relation": "root" },
    { "dependent": "3", "head": "2", "relation": "obj" },
    { "dependent": "4", "head": "2", "relation": "punct" }
  ],
  "rootCount": 1,
  "supportBoundary": "Readiness-only expected arcs; no parser behavior is implemented or claimed.",
  "notes": [
    "Arcs are copied from the repository-authored CoNLL-U fixture."
  ]
}
